{
  "schema_version": "workspace-lifecycle-0.1",
  "workspace_id": "WORKSPACE_EXAMPLE",
  "lifecycle_class": "EPHEMERAL_RECONSTRUCTIBLE",
  "owner": "I3_ENGINEERING_CAMPAIGN_LEAD",
  "created_at": "2030-01-01T00:00:00Z",
  "expires_at": "2030-01-01T06:00:00Z",
  "lease_until": null,
  "safe_delete": false,
  "source_repo": null,
  "source_ref": null,
  "reason": "Replace with the real lifecycle boundary when a system-owned workspace is created."
}
